{
  "schema_version": "1.0",
  "finding_id": "rv:0123456789abcdef0123",
  "fingerprint": "sha256:aaaaaaaaaaaaaaaaaaaaaaaaaaaaaaaaaaaaaaaaaaaaaaaaaaaaaaaaaaaaaaaa",
  "assessment": "likely_cause",
  "confidence": "medium",
  "summary": "Missing strong params permit in BooksController.",
  "provenance": {
    "provider": "openai_compat",
    "model": "gpt-4o-mini",
    "prompt_version": "v1",
    "created_at": "2026-08-17T00:00:00Z"
  }
}
